{
  "current_view": "権限と引き継ぎに加え、SDK更新時のイベント順序と差分処理も運用検証の対象になる。",
  "id": "ctx-agent-authority",
  "operator_context": {
    "authority": "実行可能な操作と接続先を列挙する。",
    "control": "承認と人間への引き継ぎ条件を確認する。",
    "evidence": "SDK更新前後のイベント順序と差分処理を再現する。"
  },
  "revisions": [
    {
      "change_reason": "業務エージェントの公開情報から、権限と引き継ぎを初期論点として記録した。",
      "changed_at": "2026-07-22T09:00:00+09:00",
      "evidence_signal_ids": [
        "sig-openai-presence-20260722"
      ],
      "id": "rev-agent-authority-001",
      "resulting_view": "業務エージェントでは、権限と人間への引き継ぎ条件が導入判断の中心になる。"
    },
    {
      "change_reason": "Managed Agents対応のSDK更新により、統合境界の検証項目が増えた。",
      "changed_at": "2026-07-23T09:00:00+09:00",
      "evidence_signal_ids": [
        "sig-anthropic-sdk-20260722"
      ],
      "id": "rev-agent-authority-002",
      "resulting_view": "権限と引き継ぎに加え、SDK更新時のイベント順序と差分処理も運用検証の対象になる。"
    }
  ],
  "schema_version": "aoi.news.context.v1",
  "slug": "agent-authority",
  "supporting_signal_ids": [
    "sig-openai-presence-20260722",
    "sig-anthropic-sdk-20260722"
  ],
  "title": "Agent Authority",
  "updated_at": "2026-07-23T09:00:00+09:00"
}
